skill,keywords,description
Python,"python,list comprehension,decorators,generators,fastapi,django,flask","High-level programming language known for readability, extensive libraries, and backend development."
JavaScript/TypeScript,"js,ts,es6,async,await,promises,interface,type","Core programming languages of the web, with TypeScript adding static types for larger scale."
React/Next.js,"react,nextjs,ssr,csr,hooks,state,props,tailwind","Modern frontend frameworks for building rich, interactive, and search-optimized user interfaces."
PostgreSQL,"postgres,sql,indexes,foreign keys,joins,transactions,acid","Highly stable and standards-compliant open-source object-relational database system."
APIs & Backend,"fastapi,api,rest,graphql,endpoint,middleware,http","Developing server-side applications, handling HTTP requests, routing, and database integrations."
LangChain/LangGraph,"langchain,langgraph,agents,chains,state,llm,rag","Frameworks for building context-aware, reasoning applications and multi-agent workflows."
